{
  "$schema": "https://json-schema.org/draft/2020-12/schema",
  "$id": "https://schemas.starfall.invalid/contracts/data/mining-rules.schema.json",
  "title": "MiningRulesTable",
  "description": "Shape of data/mining/mining-rules.json (p1-02): the three numbers every extraction is judged by (spec p1-02 section 4.2). In range iff |ship - deposit|^2 <= (radius_m + mining_range_from_surface_m)^2; slow enough iff |ship velocity|^2 <= max_ship_speed_mps^2; both on the authoritative f64 state at the START of the tick the command is processed in. cooldown_s * tick_hz must be an integer (boot check). 단위 접미사 규약: 수치 필드 이름이 단위로 끝난다 (_m, _mps, _s, _kg). **_kg 필드는 정수다** — 수량은 경제 값이므로 ADR-0009 section 2 의 SI 실수 예외에 들지 않는다(primitives MassKg). _s 필드도 정수이고 tick_hz 를 곱해 정수 tick 이 되어야 한다(서버 기동 검증).",
  "type": "object",
  "required": [
    "schema_version",
    "id",
    "extraction"
  ],
  "properties": {
    "schema_version": {
      "$ref": "../common/primitives.schema.json#/$defs/SchemaVersion"
    },
    "id": {
      "$ref": "../common/primitives.schema.json#/$defs/DataId"
    },
    "designer_note": {
      "type": "string",
      "maxLength": 2000
    },
    "extraction": {
      "title": "MiningExtractionRules",
      "type": "object",
      "required": [
        "mining_range_from_surface_m",
        "max_ship_speed_mps",
        "cooldown_s"
      ],
      "properties": {
        "mining_range_from_surface_m": {
          "type": "number",
          "exclusiveMinimum": 0.0,
          "maximum": 5000.0
        },
        "max_ship_speed_mps": {
          "type": "number",
          "minimum": 0.0,
          "maximum": 1000.0
        },
        "cooldown_s": {
          "type": "integer",
          "minimum": 1,
          "maximum": 3600
        },
        "note": {
          "type": "string",
          "maxLength": 2000
        }
      },
      "additionalProperties": false
    }
  },
  "additionalProperties": false
}
